Time,MCC,Sender,Receiver,Latitude,Longitude,Message
4/15/2024 17:16,34,Kevin,Margaret Thompson,340,342,"Hello Margaret, I have exclusive access to CryptoGrowthX, a revolutionary investment platform. My grandfather recently passed and left me insider knowledge about crypto opportunities."
4/15/2024 17:55,35,Margaret Thompson,Kevin,340,342,"That sounds interesting. Can you tell me more about the returns? Is it safe for someone my age?"
4/15/2024 18:19,36,Kevin,Margaret Thompson,340,342,"Absolutely! CryptoGrowthX guarantees 15-20% monthly returns specifically for mature investors. 30-day money-back guarantee!"
4/15/2024 18:52,37,Margaret Thompson,Kevin,340,342,"This sounds promising. How do I register? When can I expect to see returns?"
4/15/2024 18:59,38,Kevin,Margaret Thompson,340,342,"Excellent! I'll send the secure registration link. You'll see returns within 48 hours."
4/15/2024 19:01,39,Kevin,Margaret Thompson,340,342,"Visit http://www.CryptoGrowthX.com"